[
  {
    "id": "2022-07-aiparkinscan",
    "title": "AIParkinScan",
    "excerpt": "Co-developed AIParkinScan software for Parkinson&apos;s diagnosis using audio and image data. Utilized neural networks, spectrograms, and Random Forest algorithm.",
    "venue": "MITxSureStart FutureMakers Create-a-Thon Program",
    "venue_tag": "MITxSureStart",
    "permalink": "/projects/aiparkinscan",
    "date": "2022-07-31",
    "category": "Research & ML",
    "technologies": [
      "Python",
      "TensorFlow",
      "Flask",
      "Scikit-learn",
      "Artificial Intelligence",
      "Machine Learning"
    ],
    "github": "https://github.com/agopalareddy/AIPS",
    "demo": null,
    "pdf": null,
    "presentation": "https://docs.google.com/presentation/d/10910WNa3CjiXIcH_T5OIXyOuOTiVKFHr/export/pptx",
    "has_detail": true,
    "formatted_date": "Jun 2022 – Aug 2022",
    "content_html": "<p>AIParkinScan combines two independent diagnostic signals &mdash; handwritten spiral drawings and short voice recordings &mdash; to flag early indicators of Parkinson&apos;s disease, namely micrographia (abnormally small, cramped handwriting) and vocal tremor. Audio clips are converted into spectrograms and classified with a custom convolutional neural network, while spiral drawing images are augmented and classified with a Random Forest model trained on a Kaggle spiral-drawing dataset. The two model outputs are combined into a single weighted assessment.</p><p>The project includes a Flask web front end where users can submit a drawing and a recording and receive a combined risk assessment, with all model development carried out in Jupyter notebooks. It was built during the MITxSureStart FutureMakers Create-a-Thon, with the goal of making early Parkinson&apos;s screening more accessible and affordable.</p><h4 style=\"font-family: var(--font-heading); margin-top: 1.5rem; margin-bottom: 0.5rem; color: var(--text-primary);\">Highlights</h4><ul><li>Dual-input pipeline combining audio spectrograms and spiral-drawing images</li><li>Custom CNN for spectrogram-based vocal tremor detection</li><li>Random Forest classifier with image augmentation for micrographia detection</li><li>Weighted ensemble combining both modalities into one diagnosis score</li><li>Flask web interface for user submissions</li></ul>"
  },
  {
    "id": "2022-07-artificial-intelligence-in-modern-board-games",
    "title": "Artificial Intelligence in Modern Board Games",
    "excerpt": "Built a browser-playable Java Lost Cities game with greedy, minimax, and alpha-beta AI agents that evaluate complete turn outcomes.",
    "venue": "Ohio Wesleyan University",
    "venue_tag": "OWU",
    "permalink": "/projects/artificial-intelligence-in-modern-board-games",
    "date": "2022-07-25",
    "category": "Web Apps",
    "technologies": [
      "Java",
      "HTML",
      "CSS",
      "JavaScript",
      "Artificial Intelligence",
      "OOP",
      "Game Theory",
      "Git"
    ],
    "github": "https://github.com/agopalareddy/LostCities",
    "demo": "/lost-cities/",
    "pdf": null,
    "presentation": null,
    "has_detail": true,
    "formatted_date": "Jun 2022 – Aug 2022",
    "content_html": "<p>This project implements Lost Cities, a two-player expedition card game, as part of a Summer Science Research Program with Dr. Sean McCulloch at Ohio Wesleyan University. The core game logic is written in Java and wrapped by a Node.js and Socket.IO web interface so the game can be played in the browser.</p><p>The AI layer supports greedy, minimax, and alpha-beta agents. The search agents evaluate complete turns by simulating both the outgoing card and incoming draw, then scoring the best reachable expedition outcome from the cards actually available in hand. That keeps the agents adaptable without hard-coded opening thresholds.</p><h4 style=\"font-family: var(--font-heading); margin-top: 1.5rem; margin-bottom: 0.5rem; color: var(--text-primary);\">Highlights</h4><ul><li>Java implementation of full Lost Cities rules and scoring</li><li>Greedy, minimax, and alpha-beta AI modes for human-vs-AI and AI-vs-AI play</li><li>Known-card search evaluation that avoids weak expedition starts without tuned thresholds</li><li>Browser-playable Node.js and Socket.IO wrapper around the Java engine</li><li>Regression self-check for fixed-seed AI-vs-AI termination</li></ul>"
  },
  {
    "id": "2022-11-connect-4-ai",
    "title": "Connect 4 AI",
    "excerpt": "Co-developed an AI opponent for Connect 4 using alpha-beta pruning algorithm.",
    "venue": "Ohio Wesleyan University",
    "venue_tag": "OWU",
    "permalink": "/projects/connect-4-ai",
    "date": "2022-11-30",
    "category": "Web Apps",
    "technologies": ["Java", "HTML", "CSS", "JavaScript", "OOP", "Artificial Intelligence", "Git"],
    "github": "https://github.com/agopalareddy/connect-4-ai",
    "demo": "/connect4/",
    "pdf": null,
    "presentation": null,
    "has_detail": true,
    "formatted_date": "Aug 2022 – Dec 2022",
    "content_html": "<p>A Java implementation of Connect 4 supporting both two-player and single-player (vs. AI) modes, built as a final project for an Ohio Wesleyan University course with collaborators Alex Casper and Jose Mancilla. The AI opponent uses alpha-beta pruning, an optimization of the minimax search algorithm that prunes branches of the game tree that cannot affect the final decision, allowing it to look further ahead without exploring the full tree. A browser-playable version is available via the live demo below.</p><p>Game logic and the core implementation were led by Aadarsha Gopala Reddy, the AI opponent by Alex Casper, with extensive testing and debugging of the alpha-beta search by Jose Mancilla.</p><h4 style=\"font-family: var(--font-heading); margin-top: 1.5rem; margin-bottom: 0.5rem; color: var(--text-primary);\">Highlights</h4><ul><li>Full Connect 4 rules with win/draw detection in Java</li><li>AI opponent using alpha-beta pruning (minimax-based search)</li><li>Single-player (vs. AI) and two-player modes, with choice of who moves first</li><li>Browser-playable demo alongside the Java implementation</li></ul>"
  },
  {
    "id": "2023-04-artificial-intelligence-opinion-survey",
    "title": "Artificial Intelligence Opinion Survey",
    "excerpt": "Designed, fielded, and investigated a survey research of 1000 employees to analyze AI&apos;s impact on work efficiency and attitudes. Found AI improved efficiency across industries.",
    "venue": "Ohio Wesleyan University",
    "venue_tag": "OWU",
    "permalink": "/projects/artificial-intelligence-opinion-survey",
    "date": "2023-04-30",
    "category": "Research & ML",
    "technologies": [
      "Research",
      "Data Analysis",
      "R",
      "Tableau",
      "Qualtrics",
      "Prolific",
      "Artificial Intelligence",
      "Statistics"
    ],
    "github": "https://github.com/agopalareddy/ai-opinion-survey",
    "demo": null,
    "pdf": null,
    "presentation": null,
    "has_detail": true,
    "formatted_date": "Jan 2023 – May 2023",
    "content_html": "<p>This research project, conducted under the mentorship of Dr. Nicholas Dietrich at Ohio Wesleyan University, surveyed 1,000 employees &mdash; 250 each across education, IT/STEM, retail, and healthcare &mdash; to understand how artificial intelligence was affecting their work. Participants were recruited through Prolific and surveyed via Qualtrics, answering questions about AI&apos;s impact on their efficiency, its ability to replicate parts of their job, and their overall attitudes toward AI in the workplace.</p><p>Results were analyzed in R and visualized with Tableau dashboards, comparing AI&apos;s perceived impact across industries and demographic factors such as education, gender, and salary. Across all four industries, employees reported that AI improved their work efficiency and saved them time and effort. Findings were presented at the OWU Spring Science Symposium.</p><h4 style=\"font-family: var(--font-heading); margin-top: 1.5rem; margin-bottom: 0.5rem; color: var(--text-primary);\">Highlights</h4><ul><li>Survey of 1,000 employees across four industries (education, IT/STEM, retail, healthcare)</li><li>Participant recruitment via Prolific, survey design and delivery via Qualtrics</li><li>Statistical analysis in R with Tableau dashboards for cross-industry comparison</li><li>Presented at the OWU Spring Science Symposium</li></ul>"
  },
  {
    "id": "2024-11-php-calendar-app",
    "title": "PHP Calendar Application",
    "excerpt": "Developed Chronos, a feature-rich personal calendar and event management web app using PHP 8.4 and MySQL, with secure authentication, an interactive month-view dashboard, and a glassmorphic UI.",
    "venue": "Washington University in St. Louis",
    "venue_tag": "WashU",
    "permalink": "/projects/php-calendar-app",
    "date": "2025-07-15",
    "category": "Web Apps",
    "technologies": [
      "PHP",
      "MySQL",
      "HTML",
      "CSS",
      "JavaScript",
      "Web Security",
      "Database Design",
      "Authentication",
      "Git"
    ],
    "github": "https://github.com/agopalareddy/calendar-app",
    "demo": "/calendar/",
    "pdf": null,
    "presentation": null,
    "has_detail": true,
    "formatted_date": "Jul 2025",